{
  "clause_id": "C-GLOBAL-COMMANDS",
  "title": "Global Commands",
  "kind": "normative",
  "status": "active",
  "text": "The following commands operate across all resources and MUST remain at the global namespace level:\n\n**1. `govctl init`**\n\nInitializes a new govctl project in the current directory.\n\nSyntax: `govctl init [--force]`\n\nBehavior:\n- Creates `gov/` directory structure\n- Generates `gov/config.toml`\n- Creates subdirectories for rfcs, adrs, work items\n- Optionally creates `.claude/commands/` with workflow templates\n- MUST error if already initialized (unless `--force`)\n\n**2. `govctl check`**\n\nValidates all governance artifacts across the project.\n\nSyntax: `govctl check [--deny-warnings]`\n\nBehavior:\n- Validates RFCs, ADRs, clauses, work items, and releases\n- Implementations MUST define a corresponding machine-readable JSON Schema for each governance artifact type: RFC, clause, ADR, work item, and release\n- These schemas MUST be JSON files stored under `gov/schema/`\n- For TOML artifacts, MUST validate structure against the corresponding JSON Schema after parsing and normalization\n- The `govctl.schema` field in TOML artifacts MUST select the corresponding schema version for that artifact type\n- Checks state machine invariants\n- Verifies cross-references\n- Scans source code for references (if enabled in config)\n- In repositories that have completed RFC/clause migration, if legacy JSON RFC or clause files are detected, MUST fail with a migration-required diagnostic that points to `govctl migrate`\n- Returns exit code 0 if valid, non-zero if errors\n- With `--deny-warnings`: treats warnings as errors\n\n**3. `govctl status`**\n\nShows summary counts of all artifacts grouped by status.\n\nSyntax: `govctl status`\n\nBehavior:\n- Displays counts by status/phase for each resource type\n- Highlights active work items\n- Shows pending decisions (proposed ADRs, draft RFCs)\n- Uses colors in TTY mode for visual scanning\n- No output format flag (always human-readable table)\n\n**4. `govctl render`**\n\nGenerates markdown documentation from source-of-truth governance artifacts.\n\nSyntax: `govctl render [targets...] [--output-dir PATH] [--dry-run]`\n\nBehavior:\n- In repositories that have completed RFC/clause migration, renders RFCs from TOML to markdown (published)\n- Renders ADRs from TOML to markdown (local only)\n- Renders work items from TOML to markdown (local only)\n- Generates CHANGELOG.md from releases\n- Default: renders RFCs only\n- With targets: `rfc`, `adr`, `work`, `changelog`, `all`\n- MUST validate before rendering\n\n**5. `govctl describe`**\n\nOutputs machine-readable CLI metadata for agent/tool integration.\n\nSyntax: `govctl describe [--context]`\n\nBehavior:\n- Outputs JSON with command catalog\n- Includes workflow information\n- With `--context`: adds current project state and suggested actions\n- Enables machine agents and automation to discover capabilities safely\n\n**Stability Contract:**\n\nThe JSON schema of `govctl describe` output MUST be versioned. The schema version MUST be included in the output. Backward-incompatible changes to the schema require a major version bump of govctl.\n\nThis ensures agents and automation tools can rely on stable introspection.\n\n**6. `govctl completions`**\n\nGenerates shell completion scripts.\n\nSyntax: `govctl completions <bash|zsh|fish|powershell>`\n\nBehavior:\n- Outputs completion script for specified shell\n- Can be sourced or installed per shell conventions\n\n**7. `govctl migrate`**\n\nPerforms deterministic repository-local format migration for legacy governance artifacts.\n\nSyntax: `govctl migrate [--dry-run]`\n\nBehavior:\n- Detects legacy JSON RFC and clause files in the current repository\n- Converts legacy JSON RFC and clause files to TOML equivalents\n- Updates govctl-managed internal RFC clause-path references from `.json` paths to `.toml` paths\n- Applies any deterministic file-structure upgrades required by current TOML artifact schemas, including release-file metadata upgrades\n- Preserves artifact IDs, ordering, and semantic content during conversion\n- MUST validate converted artifacts before reporting success\n- MUST leave the repository unchanged if conversion or validation fails at any step\n- MUST be safe to run on an already-migrated repository and report a no-op result in that case\n- MUST NOT perform heuristic project discovery or broad adoption tasks\n\n**Rationale:**\n\nThese commands are global because they:\n1. Operate on multiple resource types simultaneously\n2. Don't fit the `<resource> <verb>` pattern semantically\n3. Are project-level operations, not resource-level\n4. Match user mental model of \"project commands\" vs \"resource commands\"\n\n`govctl migrate` qualifies because it operates across the governance repository as a whole and changes multiple resource types in one coordinated step.\n\n**Future Additions:**\n\nNew global commands MAY be added via RFC amendment. They MUST meet at least one criterion:\n1. Operate on multiple resource types\n2. Perform project-level initialization or cleanup\n3. Provide meta-information about the CLI itself",
  "since": "0.1.0"
}
