{
  "clause_id": "C-LIFECYCLE-VERBS",
  "title": "Resource-Specific Lifecycle Verbs",
  "kind": "normative",
  "status": "active",
  "text": "Resource-specific lifecycle verbs implement state transitions defined in [[RFC-0001]]. These verbs MUST be scoped to their resource namespace.\n\n**RFC Lifecycle Verbs:**\n\n1. `govctl rfc finalize <id> <normative|deprecated>`\n   - Implements [[RFC-0001:C-RFC-STATUS]] transitions\n   - draft → normative or draft → deprecated\n\n2. `govctl rfc advance <id> <spec|impl|test|stable>`\n   - Implements [[RFC-0001:C-RFC-PHASE]] transitions\n   - Forward-only phase progression\n\n3. `govctl rfc bump <id> <patch|minor|major> -m <message>`\n   - Version bumping per semantic versioning\n   - Updates changelog automatically\n   - Optional: `--change <description>` for additional changelog entries\n\n4. `govctl rfc supersede <id> --by <replacement-id>`\n   - Marks RFC as superseded by another RFC\n   - Both RFCs must exist\n\n**ADR Lifecycle Verbs:**\n\n1. `govctl adr accept <id>`\n   - Implements [[RFC-0001:C-ADR-STATUS]] proposed → accepted\n\n2. `govctl adr reject <id>`\n   - Implements [[RFC-0001:C-ADR-STATUS]] proposed → rejected\n\n3. `govctl adr supersede <id> --by <replacement-id>`\n   - Implements [[RFC-0001:C-ADR-STATUS]] accepted → superseded\n   - Both ADRs must exist\n\n**Work Lifecycle Verbs:**\n\n1. `govctl work move <id> <queue|active|done|cancelled>`\n   - Implements [[RFC-0001:C-WORK-STATUS]] transitions\n   - Validates gate conditions (e.g., acceptance criteria for done)\n   - Updates timestamp fields automatically\n\n**Clause Lifecycle Verbs:**\n\n1. `govctl clause deprecate <id>`\n   - Implements [[RFC-0001:C-CLAUSE-STATUS]] active → deprecated\n\n2. `govctl clause supersede <id> --by <replacement-id>`\n   - Implements [[RFC-0001:C-CLAUSE-STATUS]] active/deprecated → superseded\n   - Both clauses must exist\n\n**Consistency Requirements:**\n\n1. All lifecycle verbs MUST validate transitions per [[RFC-0001]]\n2. All lifecycle verbs MUST update timestamp fields where applicable\n3. All lifecycle verbs MUST be atomic (no partial state changes)\n4. All lifecycle verbs MUST support global `--dry-run` flag\n5. Invalid transitions MUST error with clear explanation of valid transitions\n\n**Rationale:**\n\nLifecycle verbs are resource-specific because:\n- RFCs have status AND phase (two dimensions of state)\n- ADRs can be rejected (not applicable to RFCs)\n- Work items have gate conditions (acceptance criteria)\n- Each resource has different valid transitions\n\nScoping these verbs to resources makes their applicability explicit and prevents confusion.",
  "since": "0.1.0"
}
