{
  "clause_id": "C-RFC-DEF",
  "title": "RFC Definition",
  "kind": "normative",
  "status": "active",
  "text": "An RFC (Request for Comments) is a normative document that defines intent, constraints, or decisions governing implementation.\n\nAn RFC is not a suggestion. It is law.\n\nThe current canonical RFC storage format is TOML. New repositories and repositories that have completed the RFC/clause migration MUST store each RFC as a TOML file (`rfc.toml`) containing:\n- `[govctl]` section with: `schema`, `id`, `title`, `version`, `status`, `phase`, `owners`, `created`\n- optional `[govctl]` fields: `updated`, `supersedes`, `refs`, `signature`\n- `[[sections]]` array with ordered section definitions and clause references\n- `[[changelog]]` array for version history\n\nFor the schema defined by this RFC revision, `govctl.schema` MUST be `1`. Future breaking schema changes MUST increment this value via RFC amendment.\n\nEntries in `sections[].clauses` MUST reference clause TOML files by relative path (for example `clauses/C-EXAMPLE.toml`) in migrated repositories.\n\nRepositories that have not yet completed the RFC/clause migration MAY retain legacy JSON RFC files temporarily. After `govctl migrate` has completed for a repository, normal govctl operations MUST create and modify RFCs only in TOML form.\n\n**Rationale:**\nThis removes the last storage-format split from RFC handling without forcing a silent in-place break for repositories that still need an explicit migration step.",
  "since": "1.0.0"
}
