{
  "clause_id": "C-CLAUSE-DEF",
  "title": "Clause Definition",
  "kind": "normative",
  "status": "active",
  "text": "A clause is an individual requirement or statement within an RFC.\n\nThe current canonical clause storage format is TOML. New repositories and repositories that have completed the RFC/clause migration MUST store each clause as a TOML file containing:\n- `[govctl]` section with: `schema`, `id`, `title`, `kind`, `status`\n- optional `[govctl]` fields: `since`, `superseded_by`, `anchors`\n- `[content]` section with: `text`\n\nFor the schema defined by this RFC revision, `govctl.schema` MUST be `1`. Future breaking schema changes MUST increment this value via RFC amendment.\n\nAfter `govctl migrate` has completed for a repository, normal govctl operations MUST create and modify clauses only in TOML form.\n\nRepositories that have not yet completed the RFC/clause migration MAY retain legacy JSON clause files temporarily.\n\nClause kinds:\n- **normative**: Defines a requirement. Implementations MUST comply.\n- **informative**: Provides context. No compliance requirement.\n\nDeprecation is a lifecycle state (in `status`), not a document kind.\n\n**Rationale:**\nThis aligns clause storage with RFC, ADR, Work Item, and Release storage while preserving an explicit migration boundary for existing repositories.",
  "since": "1.0.0"
}