{
  "clause_id": "C-ADR-DEF",
  "title": "ADR Definition",
  "kind": "normative",
  "status": "active",
  "text": "An ADR (Architectural Decision Record) documents a significant design decision.\n\nEvery ADR MUST be stored as a TOML file containing:\n- `[govctl]` section with: `schema`, `id`, `title`, `status`, `date`, `refs`\n- optional `[govctl]` field: `superseded_by`\n- `[content]` section with: `context`, `decision`, `consequences`\n\nFor the schema defined by this RFC revision, `govctl.schema` MUST be `1`. Future breaking schema changes MUST increment this value via RFC amendment.\n\nImplementations MUST define a machine-readable JSON Schema for the ADR file structure and MUST validate ADR files against that schema during project validation.\n\nADR status lifecycle:\n\n    proposed → accepted → superseded\n             → rejected\n\n**proposed**: Under consideration. Not yet binding.\n\n**accepted**: Ratified. Design SHOULD follow this decision.\n\n**rejected**: Declined after consideration. Reason documented in decision field.\n\n**superseded**: Replaced by a newer ADR. Listed in `superseded_by` field.",
  "since": "1.0.0"
}
